"Name","Position","Team","Bye Week","Rank","Points","Risk","Upside","ADP","Tier","Outlook","Dynasty","Markers"
"Rashod Bateman","WR","BAL","7","91","68.6","4.5","4.2","19.05","11","When you are in the last round of your draft, shoot for the moon. Shoot for a guy who hasn’t done it yet in the hopes you find a diamond in the rough. Through five years, Bateman has yet to clear nine fantasy points per game. We will be happy to snag him off the waiver wire in the event of a Zay Flowers injury, but we would prefer to take some swings on younger rookies or insurance RBs late in drafts.","Somehow, Bateman keeps getting money from the Ravens. He has now signed multiple extensions, yet it has never happened for fantasy. He provides more value to the team for his ability to stretch the field, but at this point, the ship has sailed in dynasty land.","Mark Drafted                      Mark Keeper                      Mark Favorite                      Mark Watchlist                      Mark Avoid"
"Andrei Iosivas","WR","CIN","10","92","67.3","3.7","3.9","","11","“Yoshi” is just running around out there having a great time as the WR3 behind Ja’Marr Chase and Tee Higgins. He is good enough to stick around the league and keep his role, yet he’s not going to steal targets from Chase and Higgins. So long as both studs are healthy, Andrei should remain on the waiver wire.","Over the last two seasons, Iosivas has averaged less than 30 receiving yards per game. It ain’t happening, buddy!","Mark Drafted                      Mark Keeper                      Mark Favorite                      Mark Watchlist                      Mark Avoid"
"Elic Ayomanor","WR","TEN","10","93","66.4","4.7","4.1","17.03","11","Ayomanor was fine as a perimeter WR last year, but clearly the new regime is ready to relegate the former Stanford Cardinal to a role player after signing Wan’Dale in free agency then selecting Carnell Tate inside the top-five of the NFL Draft. For now, he is not on the radar for redraft leagues.","Unfortunately, fourth-round NFL picks don’t usually carry much long-term value in dynasty unless they are outliers. “Epic” Ayomanor was fine as a rookie (511 yards, four TDs), but he is likely to be a secondary pass catcher in Tennessee, relegating him to a bench stash in dynasty with the hopes that he can make his way onto the field in 3WR sets over Calvin Ridley.","Mark Drafted                      Mark Keeper                      Mark Favorite                      Mark Watchlist                      Mark Avoid"
"Kyle Williams","WR","NE","14","94","66.0","5.0","5.7","18.08","11","The 3rd round pick was barely involved as a rookie and now with the arrival of A.J. Brown and Romeo Doubs, he looks very unlikely to be a fantasy asset in 2026. Sorry Williams truthers but a 4% target share as a rookie is not going to get it done.","We kind of liked Williams as a fun prospect last year, but as things go in dynasty land, there are way more misses than hits. Unless Williams does a 180 in Year 2, it is bleak, folks. He caught just 10 passes as a rookie despite appearing in all 17 games. Ew.","Mark Drafted                      Mark Keeper                      Mark Favorite                      Mark Watchlist                      Mark Avoid"
"Pat Bryant","WR","DEN","12","95","65.7","2.3","3.0","15.12","11","Bryant did very little early in the season, but as the year went on, he started to pop as the team scaled back Troy Franklin’s role. Unfortunately, a concussion and hamstring injury limited his production late in the year, so entering Year 2, there are still question marks on Bryant as a player. He will have a role, but it is highly unlikely to be fantasy relevant now that Jaylen Waddle is on this roster. Consider him a potential waiver wire pickup if Waddle and/or Sutton miss time.","Bryant’s dynasty value took a huge hit when the Broncos sent a first round pick for Jaylen Waddle. He’s a fun prospect who flashed at times as a rookie, so we would like to stash him if possible; It just might take a year or two for him to get a full-time role after Courtland Sutton ages out.","Mark Drafted                      Mark Keeper                      Mark Favorite                      Mark Watchlist                      Mark Avoid"
"Mack Hollins","WR","NE","14","96","65.2","5.3","3.4","","11","If your league awards points for aura, Mack Daddy is the 1.01. The shoeless wonder is a weekly must-see for his interesting stadium entrances. He was a solid player for New England on their Super Bowl run a year ago, but with AJ Brown joining the squad, he is not on the radar for fantasy.","We are huge fans of Hollins’ Instagram account, where he shares all sorts of useful info for everyday tasks labeled #MackHacks. Oh, you came here for his dynasty value? It does not exist. But seriously, give the guy a follow on IG, and thank us later.","Mark Drafted                      Mark Keeper                      Mark Favorite                      Mark Watchlist                      Mark Avoid"
"Jahan Dotson","WR","ATL","9","97","60.7","3.5","2.5","","11","Super Bowl champion and Eagles legend, Jahan Dotson, is now in Atlanta after signing a two-year deal in free agency. Behind Drake London, this WR room is full of some #NastyBoys, and Dotson might be the nastiest of them all. THE cardio king, Dotson has averaged an embarrasingly low 0.63 yards per route run over the last two seasons. It’s hard to put into words how bad that is…","If you are still holding Jahan Dotson in your dynasty league, it is time. Set him free and never look back!","Mark Drafted                      Mark Keeper                      Mark Favorite                      Mark Watchlist                      Mark Avoid"
"Chimere Dike","WR","TEN","10","98","60.7","5.1","3.7","16.03","11","Dike provided a ton of value for the Titans, especially in the return game. In fact, the guy set the NFL rookie record for the most all-purpose yards in a single season with 2,427 scrimmage yards in 2025. He is electric in the return game, and that is probably where he will shine as Carnell Tate, Wan’Dale Robinson, and Calvin Ridley run the most routes. He is not fantasy relevant right now, but if one of the WRs goes down to injury, we at least know he can play.","Dike is a dart throw/end-of-bench stash in dynasty formats. Obviously, his outlook is capped with Carnell Tate going fourth overall and Wan’Dale signing that big contract in free agency. Perhaps he can carve out the WR3 role over time.","Mark Drafted                      Mark Keeper                      Mark Favorite                      Mark Watchlist                      Mark Avoid"
"Zachariah Branch","WR","ATL","","99","57.8","4.3","5.2","17.06","11","We know Drake London is the dude here in Atlanta, but behind him, this depth chart is wide open. The Falcons used the 79th overall pick on the former Georgia Bulldog, so he has a realistic opportunity to see the field as a rookie. Electric in the return game and dangerous with the ball in his hands, Branch was used primarily in the screen game and on manufactured touches in college. He is going to have to develop in the NFL to be a factor for fantasy, but perhaps he can be a late-season riser.","If Branch is going to work for fantasy in the long run, he is going to have to be an outlier. He is an undersized speed WR, and 45% of his career targets in college came behind the line of scrimmage, with over 35% of his career yards coming via screens. Yikes! This is the exact type of profile that has burned dynasty players in the past, but when you look at the state of this depth chart behind Drake London, you can squint and see a path. We consider him a dart-throw type of stash in dynasty formats.","Mark Drafted                      Mark Keeper                      Mark Favorite                      Mark Watchlist                      Mark Avoid"
"Xavier Legette","WR","CAR","14","100","56.9","4.7","4.2","","11","Legette lost his WR2 job last year to Jalen Coker, and we are projecting that to stick in 2026. Tetairoa McMillan should dominate the target share here, and Coker is a fine WR2 option for the team. Call us crazy, but we are not drafting Bryce Young’s WR3, especially after he saw four or fewer targets in eight of his final 10 games to close 2025.","This man’s accent is fun, and he is a good time. That is about where the positives end for Legette’s dynasty outlook. Through two seasons, he is averaging 1.11 YPRR. I think we all know where this is headed…","Mark Drafted                      Mark Keeper                      Mark Favorite                      Mark Watchlist                      Mark Avoid"
"Dontayvion Wicks","WR","PHI","5","101","54.9","5.3","3.3","","11","The Eagles traded for Dontayvion Wicks and immediately signed him to a one-year extension as he has some familiarity with new OC Sean Mannion, who comes over from Green Bay. We ultimately expect him to be mixing in with Hollywood Brown on the perimeter, but unless Jalen Hurts all of a sudden becomes a prolific passer, Wicks isn’t likely to be a meaningful fantasy contributor behind Smitty and Makai Lemon.","Wicks has always flashed target-earning potential (and drops), and he is just 24 years old. You could probably throw him in your starting lineup should DeVonta Smith or Makai Lemon miss some time, so if you are in a deeper league, you could certainly keep him on the end of your bench. Philly signed him to a one-year extension worth $12.5 million after trading for him earlier this spring.","Mark Drafted                      Mark Keeper                      Mark Favorite                      Mark Watchlist                      Mark Avoid"
"Jaylin Noel","WR","HOU","6","102","54.5","4.2","3.5","18.01","11","Houston double-dipped in the 2025 NFL Draft on Day 2, taking both Iowa State WR prospects. They grabbed Jayden Higgins in Round 2 and Noel in Round 3, and neither guy really stepped up for fantasy on a consistent basis. Noel was stuck behind Christian Kirk for the slot role last year, but with Kirk gone, he has a chance to win that slot role.","Noel is a fine stash right now until we see if he can make a jump in Year 2. It is a small sample size, but the efficiency marks aren’t terrible (1.50 YPRR, 8.3 YPT) for a former Day 2 pick.","Mark Drafted                      Mark Keeper                      Mark Favorite                      Mark Watchlist                      Mark Avoid"
"Marvin Mims Jr.","WR","DEN","12","103","54.1","2.7","1.7","18.05","11","This guy is so fun to watch when he is making an explosive play, but through three years, he has played just 32% of the snaps. Darn you, Sean Payton! You tricked us thrice into thinking he could actually be something! We know now, he is pretty much just their kick returner.","Mims will always be remembered in dynasty formats on the promise of “Sean Payton traded up in the second round to draft this guy.” Sadly, he’s just a part-time player who will never have any real value. Oh, what could have been!","Mark Drafted                      Mark Keeper                      Mark Favorite                      Mark Watchlist                      Mark Avoid"
"Tez Johnson","WR","TB","9","104","53.7","4.6","3.6","","11","Tiny Tez! This guy flashed when his number was called in 2025, as Mike Evans and Chris Godwin missed a bunch of time last season. Unfortunately, unless you are an outlier, former seventh-round picks who weigh 165 pounds don’t usually go on to be fantasy stars. Tampa probably views him as a depth piece behind Egbuka, Godwin, McMillan, and Ted Hurst.","Tez Johnson actually had a really solid production profile coming out of Oregon, and you saw in his rookie year that he belongs in the league. That doesn’t necessarily mean he is worth a roster spot in dynasty, as he is buried on the depth chart.","Mark Drafted                      Mark Keeper                      Mark Favorite                      Mark Watchlist                      Mark Avoid"
"Ja'Kobi Lane","WR","BAL","","105","52.2","4.7","5.0","16.12","11","Lane saw a bunch of contested catches at USC, which is interesting considering his slender build. Expect him to start the season behind Flowers and Rashod Bateman in a part-time role with the chance to develop over the course of his rookie season. For now, he is not worth looking at in fantasy drafts.","The production profile for Lane is pretty underwhelming, but he is an early declare prospect who played next to Makai Lemon at USC, so we will leave the light on for him in dynasty formats as a stash. This is a new coaching staff, and Rashod Bateman hasn’t exactly been a prolific weapon for the team in recent years. If he surprises as a rookie, there is a path, but it’s a pretty thin bet.","Mark Drafted                      Mark Keeper                      Mark Favorite                      Mark Watchlist                      Mark Avoid"
"Malachi Fields","WR","NYG","","106","51.8","5.4","3.7","20.02","11","The Giants traded multiple picks to land Notre Dame’s Malachi Fields, so the new staff likely has a role in mind for him. At 6’5” and 218 pounds, he is a true X receiver. Unfortunately, for fantasy, Fields looks like a guy who is more likely to help the Giants than help our fantasy teams, as he is a pretty weak prospect coming out of Notre Dame. We know Malik Nabers is the alpha when healthy, and the team paid big money to Isaiah Likely in free agency. We would be surprised if he is able to generate enough volume to matter for fantasy, but he could have some TD upside in the right matchups thanks to his power forward frame.","Analytically, Fields doesn’t have a lot going for him in terms of numbers. He is an older prospect who specializes as a field stretcher and contested catch target. Generally speaking, those profiles haven’t really hit for dynasty, but with Wan’Dale Robinson gone and Darius Slayton likely not around for much longer, the landing spot says we need to keep the light on over the next 1-2 years, as he could be the second option across from Malik Nabers.","Mark Drafted                      Mark Keeper                      Mark Favorite                      Mark Watchlist                      Mark Avoid"
"Elijah Sarratt","WR","BAL","","107","50.9","4.5","4.3","19.03","11","There are talks of Sarratt moving into the ‘Big Slot’ role in Year 1 in Baltimore, which is kind of intriguing in deep formats. Sarratt is a ball winner who was frequently used in the red zone in college, giving him life as a contributor right away as a rookie in Baltimore. That said, we expect Flowers and Bateman to open the season as the top WRs on the depth chart, and the Ravens have never had a high pass rate in the Lamar Jackson era, so the path for fantasy is pretty thin out of the gate. He is not on the radar right now as a redraft target, but know the name for the waiver wire in the event Flowers or Bateman miss time due to injury.","Baltimore double-dipped in the NFL Draft, taking Ja’Kobi Lane in Round 3, then Sarratt in Round 4. Even though the Ravens took Lane first, you could argue Sarratt is the better prospect for the game we play. Not only did he catch 15 TDs for the National Champion Hoosiers, but he also had a 2.56 career yards per route run rate and was second in the entire class behind only Makai Lemon in first downs per route run.","Mark Drafted                      Mark Keeper                      Mark Favorite                      Mark Watchlist                      Mark Avoid"
"Xavier Hutchinson","WR","HOU","6","108","50.5","4.1","2.6","","11","We all assumed last year’s rookies, Jayden Higgins and Jaylin Noel, would steal playing time from boring vets like Xavier Hutchinson, but he was able to keep his role all season, playing 58% of the snaps. Unfortunately, he is not an efficient player and has averaged less than 13 receiving yards per game in his career (Hey, don’t laugh). He could mix in for snaps again this season, but that does not mean he will be fantasy viable.","Hutchinson is entering the final year of his rookie deal with Houston, so he will likely be looking for work on the open market next season as the Texans look to Jayden Higgins and Jaylin Noel (and maybe Tank Dell?) as their future depth pieces behind Nico Collins.","Mark Drafted                      Mark Keeper                      Mark Favorite                      Mark Watchlist                      Mark Avoid"
"De'Zhaun Stribling","WR","SF","","109","50.1","7.8","5.2","21.05","11","The Niners shocked everyone by taking De’Zhaun Stribling 33rd overall in the NFL Draft. He was projected by most as a Day 2 guy, but no one saw this coming. It suggests they have a plan for him, but as long as Mike Evans and Ricky Pearsall are healthy (which is no sure thing), Stribling figures to be more of a role player in Year 1.","From a dynasty outlook, the draft capital here is doing A LOT of the heavy lifting. Analytically, Stribling is a pretty weak prospect. He is already 23 years old after playing five collegiate seasons, and in those five years, he cleared 850 receiving yards just once. One area where he does excel is after the catch, which is usually what the 49ers look for in their WRs. He is also good in the blocking game…sure sounds like a Kyle Shanahan receiver, doesn’t it? All in all, we are not expecting much in Year 1, and analytically, it is an uphill battle for this to work. That said, if ever there was a scheme to get the most out of Stribling, it’s this one in San Fran.","Mark Drafted                      Mark Keeper                      Mark Favorite                      Mark Watchlist                      Mark Avoid"
"Chris Brazzell II","WR","CAR","","110","49.8","6.1","5.1","19.04","11","At 6’4” and 198 pounds, Brazzell has the prototypical perimeter deep threat build. He will likely compete with Xavier Legette for playing time as a rookie and be a part-time contributor. After all, are we really that excited about the third or fourth option in a Bryce Young offense? No offense, Bryce!","It is always tough to project these Tennessee WRs from college to the pros, so we see a wide range of outcomes for Brazzell. He is a tall, rangy perimeter player who can win down the field, but he likely needs to develop more of a refined skillset to make it in the league. He is a fine stash, but we are not overly excited about it.","Mark Drafted                      Mark Keeper                      Mark Favorite                      Mark Watchlist                      Mark Avoid"
"Roman Wilson","WR","PIT","5","111","49.7","5.1","2.7","","11","Pittsburgh took Roman Wilson in the third round back in 2024, and after struggling to stay healthy in Year 1, he was just a part time player in 2025. Hey, to his credit, he did finish as the WR8 in Week 8 against the Packers, so he’s got that going for him. #NeverForget. He is likely to be a part-time player again in 2026, who is stuck behind Pitty City, Metcalf, and second-round rookie Germie Bernard.","There are hundreds of players you once took in the second or third round of a rookie draft who never went on to do anything in the league. Mr. Wilson is on that list, sadly. If he is still on your dynasty squad, take some advice from Michael Jordan: “Stop it. Get some help.”","Mark Drafted                      Mark Keeper                      Mark Favorite                      Mark Watchlist                      Mark Avoid"
"Kalif Raymond","WR","CHI","8","112","49.3","4.7","3.3","","11","Raymond had a bit role with the Lions as an undersized slot receiver who primarily contributed on special teams. Ironically, he is now reunited with Ben Johnson in Chicago, so he should have no issues carving out a nice little role for the Bears. We do not expect that role to be fantasy relevant.","Raymond should not be on a dynasty roster at this point in time…or ever.","Mark Drafted                      Mark Keeper                      Mark Favorite                      Mark Watchlist                      Mark Avoid"
"Olamide Zaccheaus","WR","ATL","5","113","49.1","2.5","2.5","","11","The wee little man signed a two-year deal with the Falcons in free agency, and if you have been following the NFL long enough, that probably sounds familiar. He actually began his career with Atlanta as a UDFA back in 2019, so we have a bit of a reunion situation going on here. Quite honestly, there is a chance he sees some playing time given the state of the depth chart behind Drake London. That said, we don’t anticipate him being fantasy relevant as he has been in the league for seven years and has never averaged more than 5.5 fantasy PPG.","The fact that this man has survived in the NFL for 7+ years as a former UDFA should be celebrated. The “How is he still in the league?” Footie will be in the mail shortly…","Mark Drafted                      Mark Keeper                      Mark Favorite                      Mark Watchlist                      Mark Avoid"
"Jordan Whittington","WR","LAR","8","114","47.1","4.7","3.3","","11","Whittington is a McVay guy through and through. Before the team’s Week 8 bye, he averaged 62% of the snaps, but the production was minimal. We have noticed that anytime Puka Nacua or Davante Adams was off the field, McVay trusts Whittington to immediately step into their every-down role, especially as a blocker. Ignore at your drafts, but do not be surprised if we hear from Whittington at some point in 2026 if the Rams WRs have the injury bug.","He likely means more to the Rams than for fantasy entering Year 3. Stash if you think he can see volume if Puka or Davante went down. Drop him if you do not.","Mark Drafted                      Mark Keeper                      Mark Favorite                      Mark Watchlist                      Mark Avoid"
"Cedric Tillman","WR","CLE","9","115","46.9","4.5","3.6","","11","We might have mentioned Tillman as a Sleeper last summer thinking he could seize opportunity as Cleveland’s WR2. Welp, nothing to see here! Move along! The team has a completely new regime and restocked the WR position with rookies KC Concepcion and Denzel Boston.","Tillman had his moment and he failed to “Carpe Diem”. He can be dropped safely.","Mark Drafted                      Mark Keeper                      Mark Favorite                      Mark Watchlist                      Mark Avoid"
"Dont'e Thornton Jr.","WR","LV","8","116","45.7","5.6","3.5","","11","The Raiders' fourth-round pick from 2025 was one of those “summer flings”. He gained some steam with a few camp highlights and some beat reporters lauding him to be the team’s starting X. Listen, we get it; summer is a time for being young and passionate. The dude caught ten passes on the season, including laying a goose egg in the receptions department in eight of his 15 games. Consider this a hard “No!""","It was always a pipe dream thinking Thornton could turn into anything meaningful. We consistently preach this adage for incoming WRs for dynasty: if they cannot earn targets in college, why would they be able to do it in the NFL? Thornton was targeted on 13% of his routes and averaged 0.60 YPRR as a rookie, which puts him in “punt Baxter off a bridge” territory in dynasty.","Mark Drafted                      Mark Keeper                      Mark Favorite                      Mark Watchlist                      Mark Avoid"
"Kendrick Bourne","WR","ARI","14","117","44.7","3.7","2.7","","11","Bourne will randomly pop up for monster games as he did in Weeks 5 and 6 last year. He hit 142 receiving yards exactly in back-to-back games and then (get this) averaged 18 receiving yards per game the rest of the year. Impress your buddies at your draft, saying “oh yeah, that guy is a Cardinal” before crossing him off your draft list.","It feels like Bourne has lived 38 different lives in the NFL. This life he will be living as part of the Arizona Cardinals is not one you want to be part of.","Mark Drafted                      Mark Keeper                      Mark Favorite                      Mark Watchlist                      Mark Avoid"
"Jaylin Lane","WR","WAS","12","118","43.6","5.0","2.8","","11","A fourth-round pick in 2025, Lane saw limited action in a lost season for the Commanders, totaling just 16 receptions. He will be competing with incoming rookie Antonio Williams, veteran Van Jefferson, and the ghost of Treylon Burks for the WR2 job behind Terry McLaurin. Know the name, but you can ignore him to start the season.","Lane is a fringe dynasty asset with the sole glimpse of light being an ambiguous WR depth chart behind Terry. He was targeted on 17% of his routes and averaged 1.24 yards per route run, both middling marks but not death sentences to his prospects. He is not a must hold, but if you want to wait-and-see what happens in Washington, be our guest.","Mark Drafted                      Mark Keeper                      Mark Favorite                      Mark Watchlist                      Mark Avoid"
"Hollywood Brown","WR","PHI","10","119","43.1","5.1","3.7","","11","HOLLYWOOOOOOD is still fun to say on the podcast, but honestly, do you have any memory of what Brown did in the 2025 season? Apart from a Week 1 surprise when he saw 16 targets with Rashee Rice out, it was mostly forgettable despite leading all Chiefs WRs in receiving yards (587). Your league mates might be surprised to learn he is on the Eagles' roster in 2026. Apart from having a player named HOLLYWOOD on your roster, it will be impossible to ever start this guy.","Hollywood’s dynasty value evaporated over the last two years. The former first-round pick signed a one-year deal worth up to $6.5 million. He feels like “fancy Tutu Atwell.""","Mark Drafted                      Mark Keeper                      Mark Favorite                      Mark Watchlist                      Mark Avoid"
