"Name","Position","Team","Bye Week","Rank","Points","Risk","Upside","ADP","Tier","Outlook","Dynasty","Markers"
"Puka Nacua","WR","LAR","8","1","282.9","3.6","9.6","1.07","1","Puka was dominant in 2025 with a league-leading 107 receiving yards per game and six weeks of 20+ fantasy points, the most among WRs. He was an absolute dominator on 50/50 balls, tracking down 27 contested catches, the most of any WR over the last decade. Aside from off-the-field issues, he is simply unstoppable and off-the-charts in every per-route metric we care about for fantasy. If you wanted to take Puka at the 1.01 in a full PPR league, we totally understand.","Money please! That sound is the giant bag of cash coming Puka’s way after he totaled the second-most receiving yards through a WR’s first three years in the NFL behind only Justin Jefferson. We have him firmly amongst an elite three of WRs we would take at the very beginning of dynasty startups.","Mark Drafted                      Mark Keeper                      Mark Favorite                      Mark Watchlist                      Mark Avoid"
"Ja'Marr Chase","WR","CIN","10","2","278.4","3.2","9.7","1.06","1","Let us hit you with some hard-hitting analysis. Ja’Marr Chase is good at the game! Even with Joe Burrow missing a huge chunk of the season, the dude still finished as the WR4 with over 15 fantasy points per game. Finishing as the WR1 overall is obviously in play, especially if Burrow can finally stay healthy and have one of those elite TD seasons. He is well worth the pick early in Round 1 of fantasy drafts.","In our opinion, Chase is still viewed as one of those few untouchables in dynasty formats. Despite already being in the league for five years, he is still just 26 years old and at the peak of his prime. We have him locked in as a no-brainer top-five overall asset in dynasty.","Mark Drafted                      Mark Keeper                      Mark Favorite                      Mark Watchlist                      Mark Avoid"
"Jaxon Smith-Njigba","WR","SEA","8","3","264.8","3.0","9.4","1.08","1","If you grabbed JSN in the third round last year, you likely won your league as Smith-Njigba was incredible all year long, leading the league in receiving with almost 1,800 yards and 10 scores. His efficiency could regress after he averaged a silly 3.74 yards per route run, but he is still an easy click in the first round of fantasy drafts as one of the few guys in the league who can command a 30+% target share.","Seattle just made JSN one of the highest-paid WRs in the league, and we know the talent is immense. He is an easy top-five WR moving forward and well worth a first-round selection in start up drafts.","Mark Drafted                      Mark Keeper                      Mark Favorite                      Mark Watchlist                      Mark Avoid"
"Amon-Ra St. Brown","WR","DET","8","4","244.0","1.0","9.5","2.02","2","St. Brown is the pinnacle of consistency. He has now finished as a top-8 fantasy WR in four straight seasons, and he has banked the WR3 overall finish in three straight years as Jared Goff’s high-volume WR1. There aren’t many WRs we would want over him in redraft leagues this season, making him a rock-solid pick in Round 1 of drafts.","St. Brown is locked in with the Lions through the 2028 season, and he is still just 26 years old. We expect the fantasy goodness to continue for the next two to three years at a minimum, making him one of the most valuable WRs in all of dynasty.","Mark Drafted                      Mark Keeper                      Mark Favorite                      Mark Watchlist                      Mark Avoid"
"CeeDee Lamb","WR","DAL","10","5","240.5","2.6","9.3","2.01","2","Lamb had a good season in 2025, but it didn’t feel great considering you likely had to take him in the first round last year. He missed a few games because of the high ankle sprain, and he only scored three TDs. In the game we play, that is just not going to get it done. However, he is coming off a career high 14.4 yards per reception and has now finished with 1,000+ yards in five straight seasons. If that TD variance swings back in his direction, CeeDee can absolutely finish as a top-5 WR in 2026.","Lamb remains one of the most valuable WRs in all of dynasty, but it is at least worth considering that he is 27 years old. He will remain ultra-productive for the next couple of years, so if you have him, keep taking that top-tier production. Just have it on your radar for the next two years that the trade window might close more quickly than you think. We aren’t saying he will fall off any time soon, but we generally prefer to be a year early in order to maximize returns in the trade market.","Mark Drafted                      Mark Keeper                      Mark Favorite                      Mark Watchlist                      Mark Avoid"
"Justin Jefferson","WR","MIN","6","6","223.3","4.1","9.5","2.04","3","JJetts disappointed fantasy managers who grabbed him early in drafts last season, but was it really his fault? I mean, I think we all know who to blame here…“Nine” was one of the worst starting QBs in football, and you may forget, but Carson Wentz (yes, that guy) started five games while Max Brosmer attempted to play football in the NFL. Spoiler: It did not go well. Basically, we are completely ignoring Jefferson’s 2025 season. He is still one of the best in the game, and while Kyler is not a top-five QB, he is certainly an upgrade on whatever the heck the Vikings were doing in 2025. He is one of fantasy’s most obvious bounce-back players for 2026 and is well worth a look in Round 1 of drafts.","Jefferson is still one of the most valuable WRs in dynasty formats despite his down 2025 campaign, and we are confidently taking him in the first round of startup drafts.","Mark Drafted                      Mark Keeper                      Mark Favorite                      Mark Watchlist                      Mark Avoid"
"Drake London","WR","ATL","5","7","217.0","3.8","9.1","2.05","3","Can we get this man a QB? We know London is one of the most talented WRs in the league, yet it feels like there is still so much untapped potential given what has been going on in Atlanta. Even though Tua and Penix have their warts, we are closing our eyes in drafts and betting on talent with Drake, who has been targeted on 30% of his routes over the last two seasons. In case you missed it, the Falcons are trotting out some combination of the three stooges behind London: Jahan Dotson, Zachariah Branch, and Olamide Zacchaeus. Let’s get this guy 10+ targets a game and see what happens!","In dynasty, betting on young, highly drafted, and productive WRs is a winning strategy long term. That is why we will continue to bet on London even if the surrounding environment leaves a lot to be desired. Let’s hope the Falcons can find their long-term franchise QB next offseason because the Drake is here to stay. He signed a massive 4-year extension with the team in early June, making him one of the highest paid WRs in the league.","Mark Drafted                      Mark Keeper                      Mark Favorite                      Mark Watchlist                      Mark Avoid"
"Nico Collins","WR","HOU","6","8","209.4","4.6","8.9","2.12","4","Even with C.J. Stroud disappointing more often than not from a real-life NFL perspective, Collins continues to post WR1 numbers on a per-game basis. He is just that dude in this offense, and with Tank Dell recovering from a major injury and last year’s rookies, Jayden Higgins and Jaylin Noel, unproven commodities, Collins’ elite target share remains locked in. He is on the short list of players who are capable of finishing as a top-five fantasy WR in 2026.","Nico is now 27 years old, so he has a couple more seasons in his prime. If you are a contender, you are obviously riding this out and taking the production, but if you are a rebuilding team, we do not mind putting him on the trade block and getting a haul. Our philosophy in dynasty is that we would generally prefer to be a year early rather than a year late.","Mark Drafted                      Mark Keeper                      Mark Favorite                      Mark Watchlist                      Mark Avoid"
"A.J. Brown","WR","NE","9","9","209.3","6.0","8.0","3.09","4","You heard about it for months and it finally happened... A.J. Brown is now a Patriot.  As for the player himself, last year probably felt frustrating as Philly’s offense sputtered and he finished with career lows in yards per reception (12.9). Even in a “down” year, Brown still finished as fantasy’s WR10 and an efficient 2+ yards per route run for his 7th consecutive season. He remains one of the league's best in man coverage as an absolute bully in one-on-one situations. Perhaps a change of scenery with Drake Maye could unlock Brown for another WR1 finish in 2026.","We have had Brown as a trade-away candidate in the Dynasty Pass. It is not because we think he will have a bad season in 2026, but rather, we would prefer to maximize value after his NFL trade in the dynasty trade market a year early. You can likely still get a young WR plus a first-round rookie pick if you are willing to move off the soon-to-be 29-year-old vet.","Mark Drafted                      Mark Keeper                      Mark Favorite                      Mark Watchlist                      Mark Avoid"
"Chris Olave","WR","NO","11","10","208.5","5.7","8.8","3.04","4","Olave was buried in ADP a year ago due to concerns about the Saints' QB room and his concussion history. Fantasy drafters who took the plunge on Olave in the middle rounds last season were rewarded in a big way as Olave banked career highs in targets (156), receptions (100), yards (1,163), and TDs (9) en route to a WR6 finish. Shough for the win! After Spencer Rattler was benched, Olave went on a tear, averaging 15.8 points per game with Tyler Shough under center. The target competition will be more difficult with the addition of Jordyn Tyson, but Olave is one of the most talented WRs in the league, and we love Kellen Moore’s up-tempo scheme. We would not be shocked to see Olave post back-to-back WR1 seasons.","Olave should be able to cash in a huge payday from the Saints in the very near future, as he is entering the final year of his rookie deal after New Orleans picked up his fifth-year option. With the Saints trying to build around Tyler Shough on a cheap rookie contract, Olave’s extension should come sooner rather than later, giving him stability as a fringe WR1 in dynasty start-ups.","Mark Drafted                      Mark Keeper                      Mark Favorite                      Mark Watchlist                      Mark Avoid"
"George Pickens","WR","DAL","10","11","208.3","5.0","8.9","3.02","4","George! Jason’s My Guy came through in a huge way in his first season in Dallas. His stats are a bit juiced for those games without CeeDee Lamb, but the point remains - Pickens is a super talented WR who plays in a scheme we like with a QB in Dak who can support elite fantasy seasons. The only thing to consider for fantasy is that the ADP for him is higher than it was a season ago, so we are not getting any discounts here like we were a year ago when Pickens was available in the middle rounds.","Pickens’ dynasty outlook hangs in the balance after he signed the franchise tag with the Cowboys. Does he end up getting a huge extension with Dallas, or does he go chase the bag elsewhere in 2027? The upside is obviously there to be a top-12 to top-15 option, but the situation isn’t stable right now, given the contract question marks.","Mark Drafted                      Mark Keeper                      Mark Favorite                      Mark Watchlist                      Mark Avoid"
"Tetairoa McMillan","WR","CAR","14","12","204.0","4.0","8.2","4.01","4","McMillan delivered on the promise of being a top-10 NFL Draft pick a year ago, finishing with just over 1,000 yards and seven scores. The draft capital, Year 1 production, and efficiency marks suggest McMillan is poised for another step forward in his sophomore campaign. After seeing 25.4% of the target share a year ago as a rookie, T Mac is on our short list of WRs who could push for upwards of a 30% market share. With his talent, that should mean great things for fantasy.","It is all there for McMillan to be one of the more valuable WRs in dynasty leagues moving forward. He broke out as a rookie, has elite draft capital, and has very little target competition on his own team. He is looking like a young building block for the foreseeable future, as we all have him inside our top-12 at the position.","Mark Drafted                      Mark Keeper                      Mark Favorite                      Mark Watchlist                      Mark Avoid"
"Garrett Wilson","WR","NYJ","9","13","199.2","4.9","8.1","4.05","5","All this dude does is earn targets at an elite level. Since 2023, G Willy’s targets per route run rates are 25%, 25%, and 26%. Simply put, he is one of the best in the game at commanding a high target share. Unfortunately, that hasn't always translated into elite fantasy seasons, but we attribute that to lackluster QB play compared to other NFL WR1s. *Geno Smith has entered the chat.* Sadly, it could be the exact same scenario for Wilson in 2026. The talent is there, and the targets will be there, but the offensive environment could hold him back for fantasy once again. Nevertheless, he is a rock-solid WR2 for your team and gets a boost in full PPR formats.","If we can get this man a real QB, he could break fantasy. Until that problem is solved (maybe in 2027?!), his name will probably hold more value on your dynasty squad than the actual fantasy production. He is entering his age-26 season, and he signed a massive $130 million extension not that long ago, tying him to New York through the 2030 season.","Mark Drafted                      Mark Keeper                      Mark Favorite                      Mark Watchlist                      Mark Avoid"
"Emeka Egbuka","WR","TB","9","14","198.5","5.5","8.1","5.08","5","Respectfully, Gronk. What the heck, dude?! Before Gronk called his man Ee-Meek-Ah Eg-Big-Boo, Egbuka was on fire, operating as the WR1 in Tampa en route to a true rookie year breakout. After Gronk’s snafu on live TV, Egbuka fell off the map, averaging just 3.2 catches and 41.1 yards per game from Week 6 on. If you zoom out, however, there are a lot of reasons for that - Egbuka played through a minor hammy injury, Baker got banged up, the O-line was injured, and Emeka’s catchable target rate was terrible. If drafts present an opportunity to buy back in on the former first-round pick, we are ready to pounce, especially with Mike Evans now in San Francisco and Chris Godwin another year older.","Despite the frustrating final two months of last year, there is still a lot to like with Egbuka. He is young, he is a former first-round pick who averaged 1.75 yards per route run, and he showed he can play in this league. Godwin may not be on this team much longer, so if there is any small buying window in your league on Egbuka, thanks to his up-and-down rookie year, we are definitely interested in seeing what it costs to get him on your dyno squad.","Mark Drafted                      Mark Keeper                      Mark Favorite                      Mark Watchlist                      Mark Avoid"
"DeVonta Smith","WR","PHI","9","15","198.2","3.4","7.6","5.08","5","Smitty has always been a great talent at the WR position, but his fantasy value has been held in check with AJ Brown on the roster. With Brown gone, expect ""Slim Reaper"" to be one of the hottest names in fantasy. Smith will have a chance to set career highs in targets, receptions, and yards as the Eagles’ new WR1. His ADP will probably skyrocket, but the excitement is warranted for a guy who’s averaged 14.5 PPR points per game without Brown in the lineup going back to 2022.","Smith has always had the talent to produce like a WR1, but he has been pigeon-holed as the second option in Philly ever since the Eagles traded for AJ Brown. That should change in a big way in 2026. Expect Smith’s dynasty value to skyrocket, but just be aware that he is already turning 28 years old later this year. He is still in his prime for now, but the window is probably closing faster than you might realize.","Mark Drafted                      Mark Keeper                      Mark Favorite                      Mark Watchlist                      Mark Avoid"
"Tee Higgins","WR","CIN","10","16","195.3","6.1","8.3","4.01","5","Blurb- “Meat Higgins,” as he is known around Fantasy Footballers HQ, has now finished as a top-24 fantasy WR in four of the last five years as the Robin to Ja’Marr Chase’s Batman. As long as Joe Burrow stays healthy, we expect both guys to eat this year, with Higgins the more volatile option of the two Cincy WRs. We are fine with Higgins as a pick where he goes as a WR2 for your squad, but he has always got that sneaky WR1 upside if Chase happens to miss time.","Higgins still has three more years left on the contract extension that he signed before the 2025 season, and he is still just 27 years old. He likely has at least two to three more great seasons in him before we talk about a potential decline. Keep riding this thing out, especially if you are a contender.","Mark Drafted                      Mark Keeper                      Mark Favorite                      Mark Watchlist                      Mark Avoid"
"Rashee Rice","WR","KC","10","17","194.5","9.5","8.3","3.09","5","Welp! Another offseason discussing Rashee Rice and his off-the-field issues. Rice missed the first six weeks of the 2025 season while serving a suspension, and this past offseason, he violated his probation when he tested positive for marijuana. As a result, he is serving jail time in June and July. On top of that, we also got news in late May that Rice underwent a “clean up” procedure in his knee that could sideline him for roughly two months. If you recall, Rice’s 2024 season came to an end after he suffered a season-ending LCL, hamstring and posterolateral corner injury. So, to recap, we have another legal issue and a health concern. It all adds up to make Rice a highly volatile player entering training camp, assuming he is cleared. When on the field, he produces like a WR1 for fantasy, but there are obviously concerns. We will be tracking his situation closely over the next few months.","If you are a Rice manager in dynasty, this latest off-the-field incident feels like a complete gut punch. He is so valuable in terms of his fantasy production, but he is in a contract year and likely losing trust with the Chiefs. If they aren’t willing to pay him, and he leaves the Andy Reid and Pat Mahomes scheme, does his future production take a hit, and what happens if he is in the news again for legal troubles? His dynasty value could take a massive hit in the next 12 months.","Mark Drafted                      Mark Keeper                      Mark Favorite                      Mark Watchlist                      Mark Avoid"
"Jameson Williams","WR","DET","8","18","190.5","5.3","7.7","5.04","5","You know what is fun? Jamo ripping off chunk gains thanks to some of that elite speed. Dan Campbell knows this. John Morton? Not so much. Before Guns Mahoney took over play calling, Jameson Williams’ role was frustrating for fantasy as he was used as a low-volume, high aDOT boom/bust type of guy. However, after Campbell took over the offense, Jameson Williams was one of fantasy’s most valuable WRs as he was on pace for 1,400 yards after the Week 8 bye. It is important to note that Sam LaPorta was also out for a big chunk of the season. Still, the point remains: Jamo is crucial to the Lions’ offense reaching its full potential, and he should continue to have a high upside role that is worth targeting in fantasy drafts.","Williams just signed a massive three-year extension with the Lions, so he is locked in with Detroit through 2029. It is possible he never turns into a consistent WR1 for fantasy, but he is an extremely valuable dynasty asset who can win you a week when those big plays hit.","Mark Drafted                      Mark Keeper                      Mark Favorite                      Mark Watchlist                      Mark Avoid"
"Christian Watson","WR","GB","5","19","190.1","4.9","5.8","6.08","5","Watson’s bug-a-boo since he entered the NFL has been injuries. When he is on the field, he is highly efficient and scores plenty of fantasy points. That was on full display last season when he returned to the lineup in Week 8 off a torn ACL and went on to average 2.67 yards per route run and 11.5 fantasy points per game. The Packers’ depth chart is thinned out entering 2026, and Matthew Golden really struggled as a rookie, giving Watson relatively weak target competition for one of the better offenses in the league. There is a shaky floor with a guy like Watson due to durability concerns, but if you are looking for a high upside WR pick in the middle rounds, Watson can be nitro to your squad.","The Packers gave Watson a huge 4-year, $110 million contract extension in early June. They view him as a bonafide WR1 with this type of money but we have him in the low-end WR2 territory in dynasty.","Mark Drafted                      Mark Keeper                      Mark Favorite                      Mark Watchlist                      Mark Avoid"
"Zay Flowers","WR","BAL","7","20","189.5","4.3","7.5","5.02","5","Flowers is coming off a highly efficient 2025 campaign, setting a career high in targets (118), receptions (86), and yards (1,211). Over the last two seasons, Zay has averaged 2.61 and 2.35 yards per route run. Those are some elite marks. The guy is good! Unfortunately, the one bug-a-boo for Zay in fantasy land has been TDs. Through three seasons, he has topped out at just five scores. In order to make the leap into being a real difference maker, he is going to need to find the painted box more often. Perhaps he can fall into an outlier TD year, but with Lamar stealing some attempts in the red zone and King Henry still here, that seems somewhat unlikely for 2026.","Flowers is in his prime, productive, and tied to one of the better offenses in the league. What’s not to like?! We are in on Zay in dynasty formats, viewing him as a top-24 guy. However, we aren’t sure if he can truly level up to being a top-12 type of asset. The ceiling feels capped, but he is a rock-solid WR to have on your dyno squad.","Mark Drafted                      Mark Keeper                      Mark Favorite                      Mark Watchlist                      Mark Avoid"
"Terry McLaurin","WR","WAS","12","21","184.3","4.4","6.8","5.08","6","After being one of the most valuable WRs in fantasy in 2024, Scary Terry’s 2025 was a year to forget. Not only did McLaurin deal with injury throughout the season, but the Commanders also lost Jayden Daniels for a significant chunk of the year. To no one’s surprise, the Commanders’ offense was stuck in the mud in what was essentially a lost season. Now, looking forward to 2026, McLaurin has a chance to bounce back in a big way. The depth chart here behind McLaurin is barren, so it wouldn’t be surprising at all to see Terry push for a healthy target share and 8-10 TDs if things break right.","McLaurin got a new deal from Washington last year, but he is entering the stage of his career where you should expect some gradual decline over the next couple of seasons. He will be 31 later this year, so if you are not a contender, it is time to shop him to the rest of your league. If you are a top team in your league, we are fine riding it out and taking the production in 2026.","Mark Drafted                      Mark Keeper                      Mark Favorite                      Mark Watchlist                      Mark Avoid"
"Malik Nabers","WR","NYG","14","22","184.2","7.0","9.0","2.10","6","When on the field and healthy, there aren’t many better than Malik Nabers. Unfortunately, the talk all offseason about Nabers is going to be injury, specifically his recovery from ACL and meniscus surgery. It is one of fantasy football’s biggest storylines to monitor throughout the summer. We are projecting him to be limited early in the season, so just understand that Nabers will come with risk in redraft leagues, and it is not out of the question that he could start the season on the PUP list. If and when he does get back to 100%, he is likely to provide a big impact to your team, but you might need to wait longer than you would prefer.","Nabers is a young superstar. Those guys are really hard to acquire in dynasty leagues, but this injury might provide a small buying window. If you are not a contender and can take on some risk with your sights set on the future, Nabers is a great trade target, knowing you could really get a bounce-back season in 2027.","Mark Drafted                      Mark Keeper                      Mark Favorite                      Mark Watchlist                      Mark Avoid"
